sample_id,shap_topk,lime_topk,overlap_features,topk_agreement
1,num__ Bwd Packet Length Mean; num__ Packet Length Variance; num__ Total Length of Bwd Packets; cat__ Destination IP_192.168.10.50; num__ Avg Fwd Segment Size,cat__Flow ID_192.168.10.3-192.168.10.5-53-63733-17 <= 0.00; cat__Flow ID_172.16.0.1-192.168.10.50-52426-80-6 <= 0.00; cat__Flow ID_192.168.10.3-192.168.10.5-53-52072-17 <= 0.00; cat__Flow ID_172.16.0.1-192.168.10.50-21835-80-6 <= 0.00; cat__Flow ID_192.168.10.1-192.168.10.3-53-60571-17 <= 0.00,N/A,0.0
16,num__ Fwd IAT Std; num__ Source Port; num__ Destination Port; cat__ Destination IP_192.168.10.50; num__ Fwd Header Length.1,cat__Flow ID_172.16.0.1-192.168.10.50-49706-80-6 <= 0.00; cat__Flow ID_172.16.0.1-192.168.10.50-14833-80-6 <= 0.00; cat__Flow ID_172.16.0.1-192.168.10.50-21605-80-6 <= 0.00; cat__Flow ID_192.168.10.3-192.168.10.17-53-25486-17 <= 0.00; cat__Flow ID_172.16.0.1-192.168.10.50-15098-80-6 <= 0.00,N/A,0.0
125,num__ Fwd IAT Std; num__ Flow IAT Max; cat__ Destination IP_192.168.10.50; num__ Flow Duration; num__ Flow IAT Mean,cat__Flow ID_192.168.10.12-119.205.194.14-47728-80-6 <= 0.00; cat__Flow ID_172.16.0.1-192.168.10.50-50975-80-6 <= 0.00; cat__Flow ID_172.16.0.1-192.168.10.50-20055-80-6 <= 0.00; cat__Flow ID_172.16.0.1-192.168.10.50-50481-80-6 <= 0.00; cat__Flow ID_172.16.0.1-192.168.10.50-61953-80-6 <= 0.00,N/A,0.0
0,num__ Flow IAT Mean; num__ Fwd IAT Std; num__ Avg Fwd Segment Size; cat__ Source IP_192.168.10.15; num__ Flow IAT Max,cat__Flow ID_172.16.0.1-192.168.10.50-15687-80-6 <= 0.00; cat__Flow ID_172.16.0.1-192.168.10.50-60412-80-6 <= 0.00; cat__Flow ID_172.16.0.1-192.168.10.50-16423-80-6 <= 0.00; cat__Flow ID_172.16.0.1-192.168.10.50-18772-80-6 <= 0.00; cat__Flow ID_172.16.0.1-192.168.10.50-17839-80-6 <= 0.00,N/A,0.0
2,cat__ Destination IP_192.168.10.50; num__ Fwd IAT Std; num__ Avg Fwd Segment Size; num__ Flow IAT Max; num__Subflow Fwd Packets,cat__Flow ID_172.16.0.1-192.168.10.50-17426-80-6 > 0.00; cat__Flow ID_178.255.83.1-192.168.10.15-80-58518-6 <= 0.00; cat__Flow ID_192.168.10.3-192.168.10.15-53-57420-17 <= 0.00; cat__Flow ID_172.16.0.1-192.168.10.50-15104-80-6 <= 0.00; cat__Flow ID_192.168.10.15-52.6.13.28-58342-8080-6 <= 0.00,N/A,0.0
