sample_id,case_type,score,threshold,shap_top3,lime_top3,recommendation
1,TP,0.9096550565894475,0.44000000000000006,num__ Bwd Packet Length Mean:0.025; num__ Packet Length Variance:0.022; num__ Total Length of Bwd Packets:0.021,cat__Flow ID_192.168.10.3-192.168.10.5-53-63733-17 <= 0.00:-0.095; cat__Flow ID_172.16.0.1-192.168.10.50-52426-80-6 <= 0.00:-0.067; cat__Flow ID_192.168.10.3-192.168.10.5-53-52072-17 <= 0.00:0.056,"Escalate to IR playbook, isolate endpoint, collect packet capture."
16,FP,0.13050998188379764,0.1,num__ Fwd IAT Std:-0.037; num__ Source Port:-0.029; num__ Destination Port:-0.024,cat__Flow ID_172.16.0.1-192.168.10.50-49706-80-6 <= 0.00:-0.095; cat__Flow ID_172.16.0.1-192.168.10.50-14833-80-6 <= 0.00:-0.084; cat__Flow ID_172.16.0.1-192.168.10.50-21605-80-6 <= 0.00:0.067,De-prioritize after quick triage; tune threshold or add suppression rule.
125,FN,0.31007465301635384,0.44000000000000006,num__ Fwd IAT Std:-0.036; num__ Flow IAT Max:-0.031; cat__ Destination IP_192.168.10.50:0.028,cat__Flow ID_192.168.10.12-119.205.194.14-47728-80-6 <= 0.00:-0.082; cat__Flow ID_172.16.0.1-192.168.10.50-50975-80-6 <= 0.00:0.048; cat__Flow ID_172.16.0.1-192.168.10.50-20055-80-6 <= 0.00:-0.044,"Backtrack logs, add rule-based guardrail, retrain with hard negatives."
0,TN,0.009695935241081867,0.44000000000000006,num__ Flow IAT Mean:-0.026; num__ Fwd IAT Std:-0.024; num__ Avg Fwd Segment Size:-0.020,cat__Flow ID_172.16.0.1-192.168.10.50-15687-80-6 <= 0.00:-0.128; cat__Flow ID_172.16.0.1-192.168.10.50-60412-80-6 <= 0.00:-0.111; cat__Flow ID_172.16.0.1-192.168.10.50-16423-80-6 <= 0.00:-0.073,No immediate action; keep in periodic quality review.
2,TP,0.8677564976069467,0.44000000000000006,cat__ Destination IP_192.168.10.50:0.021; num__ Fwd IAT Std:0.018; num__ Avg Fwd Segment Size:0.017,cat__Flow ID_172.16.0.1-192.168.10.50-17426-80-6 > 0.00:0.271; cat__Flow ID_178.255.83.1-192.168.10.15-80-58518-6 <= 0.00:-0.112; cat__Flow ID_192.168.10.3-192.168.10.15-53-57420-17 <= 0.00:-0.078,"Escalate to IR playbook, isolate endpoint, collect packet capture."
